"PR_Number","Title","Author","Created_At","Merged_At","Updated_At","State","Is_Merged","Changed_Files","Additions","Deletions","Time_To_Merge_Hours","Labels","Requested_Reviewers","Final_Reviewers","Total_Reviews","Approvals","Change_Requests","Review_Comments"
"214","Feat/dsgpac 333/update schema classified","florianhyseni-aviv","2025-07-16 10:10:30","","2025-07-16 10:10:44","open","False","6","185","185","","","","","0","0","0",""
"213","chore(deps-dev): bump black from 22.12.0 to 24.3.0 in /contribs/aviv_data_platform_python_sdk","dependabot[bot]","2025-07-16 07:48:23","","2025-07-16 09:06:14","open","False","2","30","18","","dependencies, python","","","0","0","0",""
"212","feat: use new capability folders based on capapbility codes","aviv-julienjehannet","2025-07-15 16:55:10","","2025-07-15 18:03:59","open","False","86","1","4","","","","","0","0","0",""
"211","docs: add Business rules implemented in Classified Management API","aviv-julienjehannet","2025-07-15 15:33:53","2025-07-15 15:38:56","2025-07-15 15:38:59","closed","True","1","5","0","0.08","","","","0","0","0",""
"210","feat(syntax): Deprecate/remove title annotation. Not adding value at the moment (closes: #DATAPLT-187)","aviv-julienjehannet","2025-07-15 08:29:56","2025-07-15 10:55:56","2025-07-15 10:55:58","closed","True","44","2","106","2.43","","","sl-nicolasmoteley","1","1","0",""
"209","Feat: fraud-1992 - add moderation log contract","gsl-mohamedsoueid","2025-07-11 09:26:39","2025-07-11 12:18:26","2025-07-11 12:18:28","closed","True","2","43","0","2.86","data_contract","","aviv-julienjehannet","1","1","0","aviv-julienjehannet: Perfect!"
"208","feat: add python SDK","DimitriKouliche","2025-07-10 16:44:05","2025-07-16 07:46:50","2025-07-16 07:46:52","closed","True","14","2766","27","135.05","enhancement, python","aviv-julienjehannet","sl-fredericdalessandro","1","1","0",""
"207","fix(pre-commit): no ensure ascii in pretty-json hook","aviv-julienjehannet","2025-07-10 14:05:27","2025-07-10 14:10:31","2025-07-10 14:10:34","closed","True","9","16","16","0.08","","","","0","0","0",""
"206","feat(syntax): get rid of PositiveInteger instead of Integer and expli…","aviv-julienjehannet","2025-07-10 11:47:41","2025-07-10 11:57:14","2025-07-10 11:57:16","closed","True","12","29","28","0.16","","","","0","0","0",""
"205","feat: add new SF Data contracts + Add PII levels","sl-nicolasmoteley","2025-07-09 13:42:19","2025-07-11 14:31:09","2025-07-11 14:31:12","closed","True","27","526","74","48.81","data_contract","","aviv-ziyadmuhammed, sl-davidbernuau, aviv-julienjehannet, Aviv-ThomasHuebner2, sl-nicolasmoteley","14","3","0",""
"204","chore: drop unused data_product annotation","aviv-julienjehannet","2025-07-08 12:40:43","2025-07-08 12:52:12","2025-07-08 12:52:14","closed","True","39","77","76","0.19","","","","0","0","0",""
"203","fix: bump sdk and contracts to version 0.0.59","sl-fredericdalessandro","2025-07-08 10:05:22","2025-07-08 10:08:01","2025-07-08 10:08:02","closed","True","3","3","2","0.04","","","aviv-julienjehannet","1","1","0",""
"202","fix: Update ts sdk index","sl-fredericdalessandro","2025-07-08 08:24:46","2025-07-08 08:28:28","2025-07-08 08:28:30","closed","True","1","2","2","0.06","","aviv-julienjehannet","aviv-hamzaeljaoui","1","1","0",""
"201","Feat/contract set","aviv-julienjehannet","2025-07-07 16:23:12","","2025-07-16 11:12:31","open","False","42","956","280","","","","","0","0","0",""
"200","ci(github): use stale github action","aviv-julienjehannet","2025-07-07 13:13:33","2025-07-08 13:15:17","2025-07-08 13:15:19","closed","True","1","19","0","24.03","","","","0","0","0",""
"199","feat(pre-commit): propose manual check for DF001","aviv-julienjehannet","2025-07-07 10:02:11","2025-07-07 10:57:06","2025-07-07 10:57:08","closed","True","2","8","3","0.92","","","","0","0","0",""
"198","Fix/df001","aviv-julienjehannet","2025-07-07 09:48:41","","2025-07-07 09:52:24","closed","False","0","0","0","","","","","0","0","0",""
"197","fix: Buggy desynchronization with S3... To inspect","aviv-julienjehannet","2025-07-04 15:34:36","2025-07-04 15:35:15","2025-07-04 15:35:17","closed","True","1","18","10","0.01","","","","0","0","0",""
"196","feat: enable CODEOWNERS automatic generation","aviv-julienjehannet","2025-07-04 14:31:37","2025-07-04 15:21:35","2025-07-04 15:21:37","closed","True","66","438","561","0.83","","","","0","0","0",""
"195","fix: delete .idea directory","sl-fredericdalessandro","2025-07-03 09:18:23","2025-07-03 09:22:52","2025-07-03 09:22:53","closed","True","10","1","89","0.07","","","aviv-julienjehannet","1","1","0",""
"194","fix: make sure git-hooks are correctly enabled [skip ci]","aviv-julienjehannet","2025-07-02 19:04:54","2025-07-04 16:26:48","2025-07-04 16:26:50","closed","True","1","4","0","45.37","enhancement, good first issue","","","0","0","0",""
"193","fix: s3 synchronization must take into account metadata changes","aviv-julienjehannet","2025-07-02 17:33:39","2025-07-02 18:44:51","2025-07-02 18:44:53","closed","True","2","25","13","1.19","bug","","","0","0","0",""
"192","fix: keep TestAnnotations.payload immutable in tests","aviv-julienjehannet","2025-07-02 15:42:48","2025-07-02 15:47:04","2025-07-02 15:47:05","closed","True","1","6","4","0.07","","","","0","0","0",""
"191","feat: Payment Contracts V2","aviv-augustinjuricic","2025-07-02 12:42:37","","2025-07-16 11:22:22","open","False","9","177","114","","data_contract","sl-fredericdalessandro, aviv-julienjehannet","aviv-ziyadmuhammed, aviv-julienjehannet, giselle-garnett, aviv-augustinjuricic","11","1","1","aviv-ziyadmuhammed: Thanks for making the changes. Overall very complete contract with useful descriptions on all fields! Some general remarks 1. I prefer to call this contract v1 and remove current v1 contract and cases completely. They were never used. 2. The path of all the files should be src/YOUR_CAPABILITY_CODE/... @aviv-julienjehannet please help on this. 3. We are missing some crucial info on scheduling, the write mode etc. I will align with Julien on this. 4. All fields are marked as mandatory. Is this the expected behaviour? 5. In the example/case files, use a real world example so that it is clear for consumers. Of course, change the traceable ids, if any."
"190","feat:PII Feature","aviv-fathallahelmasri","2025-07-02 10:11:32","2025-07-08 12:37:27","2025-07-08 12:37:29","closed","True","4","38","0","146.43","enhancement","","aviv-julienjehannet, copilot-pull-request-reviewer[bot]","2","1","0","copilot-pull-request-reviewer[bot]: ## Pull Request Overview Adds support for annotating fields with a PII sensitivity level and propagating that metadata through JSON and Avro schemas. - Introduce a `PIILevel` field annotation class with validation for allowed levels. - Export `PIILevel` in the public API and include it in Avro metadata mappings. - Add a new test to verify that `PIILevel` annotations produce the correct schema entries. ### Reviewed Changes Copilot reviewed 4 out of 4 changed files in this pull request and generated 2 comments. | File | Description | | ------------------------------------------ | ----------------------------------------------------- | | src/aviv_data_collection_lib/contract.py | Define `PIILevel` class and validation logic. | | src/aviv_data_collection_lib/__init__.py | Export `PIILevel` in `__all__`. | | src/pydantic_avro/to_avro/custom.py | Add `""PIILevel""` to Avro custom metadata list. | | tests/test_contract_annotations.py | New `test_pii_level_annotation` to verify schemas. | <details> <summary>Comments suppressed due to low confidence (2)</summary> **src/aviv_data_collection_lib/contract.py:53** * [nitpick] Add a docstring to `PIILevel` explaining its purpose and listing valid levels for future maintainers. ``` __slots__ = (""Critical"", ""High"", ""Regular"") ``` **tests/test_contract_annotations.py:138** * Consider adding a separate test that passes an invalid level (e.g., `PIILevel(""Low"")`) to verify that a `ValueError` is raised as expected. ``` def test_pii_level_annotation(self): ``` </details>"
"189","ci: enhance artifact publishing scripts with version checks and cleanup","sl-fredericdalessandro","2025-07-01 16:57:26","2025-07-02 08:56:30","2025-07-02 08:56:32","closed","True","2","80","3","15.98","","","sl-victorceron, aviv-julienjehannet","2","2","0",""
"188","improve contract validation report per contract","aviv-julienjehannet","2025-07-01 13:52:44","2025-07-01 16:23:22","2025-07-01 16:23:24","closed","True","34","231","180","2.51","enhancement","","copilot-pull-request-reviewer[bot]","2","0","0","copilot-pull-request-reviewer[bot]: ## Pull Request Overview This PR enhances contract validation reporting by grouping and annotating errors per contract, refines logging levels and handlers, updates filesystem pattern matching, and applies a `paused` decorator to schema modules missing required examples. - Revamped `ValidationHandler` to collect, note, and optionally raise or exit with grouped exceptions. - Standardized log level icons/colors in `log.py` and introduced a dedicated handler filter for library handlers. - Adjusted `walk_contracts` pattern logic and deployment CLI to respect CI flags, and added `paused` decorator imports across schema modules. ### Reviewed Changes Copilot reviewed 29 out of 29 changed files in this pull request and generated 2 comments. <details> <summary>Show a summary per file</summary> | File | Description | | ------------------------------------------------ | ----------------------------------------------------------------- | | src/aviv_data_collection_lib/log.py | Adjust levels/icons and add separate stderr handler for handlers | | src/aviv_data_collection_lib/handlers.py | Enhanced validation reporting, grouped exceptions, added exit | | src/aviv_data_collection_lib/fs.py | Updated `root` default and `pattern.removeprefix(root)` usage | | src/aviv_data_collection_lib/contract.py | Simplified `validate()`, always return list of violations | | src/aviv_data_collection_deployment/main.py | Refactored handler setup, CI flags, and CLI argument parsing | | src/aviv_data_collection_deployment/glue_registry.py | Replaced GH CLI subprocess call with simple `--draft` flag check | | .pre-commit-config.yaml | Reorganized and added local contract-validation hook | | .poethepoet/contract.toml | Introduced `paused` and draft-check tasks | | src/aviv_data_collection_contracts/schemas/* | Switched to wildcard imports and added `@paused` decorator | </details> <details> <summary>Comments suppressed due to low confidence (5)</summary> **src/aviv_data_collection_lib/contract.py:247** * Changing the `platforms` set from `""georef""` to `""geo""` is a breaking change; ensure consumers are updated or provide a migration path. ``` platforms: ClassVar[set[str]] = {""dynamics"", ""analytics"", ""housing"", ""geo""} ``` **src/aviv_data_collection_lib/log.py:14** * Duplicate definition of the INFO level may override or conflict with earlier definitions; consider removing one of the `INFO` calls to avoid ambiguity. ``` logger.level(name=""INFO"", color=""<white>"", icon=""I: "") ``` **src/aviv_data_collection_lib/handlers.py:6** * The code in `ValidationHandler` references `inspect.getfile` but `inspect` is not imported; add `import inspect`. ``` import sys ``` **src/aviv_data_collection_lib/contract.py:241** * The validation now always appends `DCL001` regardless of module context, removing the previous test-suite exemption; reintroduce the module check to avoid false positives. ``` exceptions.append(ContractRuleViolation(""DCL001"")) ``` **src/aviv_data_collection_lib/fs.py:55** * [nitpick] Using `pattern.removeprefix(root)` can be confusing if `pattern` never starts with `root`; consider documenting this behavior or simplifying the logic. ``` for candidate in Path(root).glob(f""**/{pattern.removeprefix(root)}""): ``` </details> | copilot-pull-request-reviewer[bot]: ## Pull Request Overview This PR enhances contract validation reporting and handling, updates logging configuration, refines contract discovery logic, and cleans up imports and documentation. - Mark specific policy tests as skipped pending requirements. - Refactor `ValidationHandler` to group and report per-contract exceptions, and adjust CLI handling in `main.py`. - Update log level icons, streamline imports in contract schemas, and improve documentation. ### Reviewed Changes Copilot reviewed 34 out of 34 changed files in this pull request and generated 6 comments. <details> <summary>Show a summary per file</summary> | File | Description | |----------------------------------------------------|--------------------------------------------------------------------| | tests/test_rulesbook.py | Skip policy tests awaiting specification (DATAPLT-175). | | src/aviv_data_collection_lib/policies.py | Temporarily bypass `Ingestion.validate` logic pending spec. | | src/aviv_data_collection_lib/log.py | Change log-level icons and add handler-specific log sink. | | src/aviv_data_collection_lib/handlers.py | Refactor `ValidationHandler` and `PausedHandler` behavior. | | src/aviv_data_collection_lib/fs.py | Update default `root` and pattern handling in `walk_contracts`. | | src/aviv_data_collection_lib/contract.py | Simplify `Contract.validate` to always return errors list. | | src/aviv_data_collection_deployment/main.py | Revise handler list building and command‐line parsing. | | src/aviv_data_collection_deployment/glue_registry.py | Replace GH CLI check with simple `--draft` flag. | | src/aviv_data_collection_contracts/** | Replace explicit imports with wildcard; add `@paused` decorators. | | src/aviv/data/modeling/__init__.py | Add `Literal` export. | | src/aviv/README.md | Fix phrasing and extend folder structure example. | </details>"
"187","feat: new ts sdk version","sl-fredericdalessandro","2025-07-01 13:37:26","2025-07-01 15:20:06","2025-07-01 15:20:07","closed","True","9","127","150","1.71","","","","0","0","0",""
"186","feat/DATAPLT-182: Migrate the Team referential into Yaml file","sl-nicolasmoteley","2025-07-01 08:32:45","2025-07-03 15:16:09","2025-07-03 15:16:11","closed","True","13","248","18","54.72","","","aviv-julienjehannet","1","0","0",""
"185","feat: add primary keys on conversationmember table","li-oliviergerffroy","2025-06-30 14:33:40","2025-07-02 06:56:46","2025-07-02 06:56:48","closed","True","1","2","2","40.38","data_contract","","iwt-ddzevlan, sl-nicolasmoteley, aviv-julienjehannet","3","3","0","aviv-julienjehannet: No decision have been found for the composite primary keys. So, I can approve the PR now. See https://avivgroup.atlassian.net/browse/DATAPLT-175"
"184","feat: update SDK package metadata and simplify publish script","sl-fredericdalessandro","2025-06-30 14:11:38","2025-06-30 14:27:42","2025-06-30 14:27:43","closed","True","3","21","23","0.27","","","aviv-julienjehannet","1","1","0",""
"183","Fix/doc","aviv-julienjehannet","2025-06-30 13:50:40","2025-06-30 16:34:45","2025-06-30 16:34:46","closed","True","12","17","12","2.73","","","","0","0","0",""
"182","Feat/adjust","aviv-nsamardzic","2025-06-30 12:40:58","2025-07-03 10:13:04","2025-07-03 10:13:10","closed","True","4","187","0","69.53","data_contract","","aviv-julienjehannet","3","1","1","aviv-julienjehannet: Please, use the right github team handler for the codeowner annotation. | aviv-julienjehannet: Hi, We pushed an update of the expected data types to use in data contracts. Check the last comments for other minor changes."
"181","feat: create paused handler for uncompliant contracts","aviv-julienjehannet","2025-06-28 14:05:14","2025-06-30 14:02:43","2025-06-30 14:02:45","closed","True","11","336","367","47.96","enhancement","","copilot-pull-request-reviewer[bot]","1","0","0","copilot-pull-request-reviewer[bot]: ## Pull Request Overview This pull request introduces a new paused handler to bypass processing of noncompliant contracts and makes several adjustments across testing, schema generation, and file system modules. Key changes include the removal of legacy test and modeling handler files, modifications to schema documentation propagation and platform validation in contracts, and the addition of the PausedHandler along with updates to the main deployment flow. ### Reviewed Changes Copilot reviewed 11 out of 12 changed files in this pull request and generated 1 comment. <details> <summary>Show a summary per file</summary> | File | Description | | ------------------------------------------------------------ | --------------------------------------------------------------- | | tests/modeling/test_handlers.py | Removed legacy test file for modeling handlers. | | src/pydantic_avro/to_avro/types.py | Enhanced documentation propagation by reusing enum class docs. | | src/aviv_data_collection_lib/handlers.py | Added multiple new handlers (PausedHandler, StatisticsHandler, etc.). | | src/aviv_data_collection_lib/fs.py | Introduced contract collection enhancements in fs utility. | | src/aviv_data_collection_lib/decorators.py | Added a paused decorator with reason validation. | | src/aviv_data_collection_lib/contract.py | Updated caching, table naming and modified platform error handling.| | src/aviv_data_collection_deployment/main.py | Updated handler ordering and integration in the main deploy script.| | src/aviv_data_collection_deployment/glue_registry.py | Streamlined logger initialization and adjusted draft mode reset. | | src/aviv/data/modeling/handlers.py | Removed legacy modeling handler code. | | src/aviv/data/modeling/fs.py | Removed legacy fs file for modeling. | | .poethepoet/aws.toml | Updated AWS-related tasks and command configurations. | </details> <details> <summary>Comments suppressed due to low confidence (1)</summary> **src/aviv_data_collection_lib/contract.py:313** * Replacing an exception raise with a print statement in the platform() method may lead to silent failures. Consider restoring the exception to ensure invalid platform names are properly handled. ``` print(f""'{platform}' isn't a valid data platform name"", self.origin) ``` </details>"
"180","ci: improve versioning and publishing processes","sl-fredericdalessandro","2025-06-27 15:21:41","2025-06-27 15:29:07","2025-06-27 15:29:09","closed","True","3","19","17","0.12","","aviv-julienjehannet","","0","0","0",""
"179","fix: update CircleCI config and adjust SDK versioning","sl-fredericdalessandro","2025-06-27 14:52:36","2025-06-27 14:58:05","2025-06-27 14:58:07","closed","True","3","4","3","0.09","","","aviv-julienjehannet","1","1","0",""
"178","feat: add network_names field for Boost Self Service data contract","sl-nicolasmoteley","2025-06-27 14:46:51","2025-06-30 08:44:56","2025-06-30 08:44:57","closed","True","2","5","1","65.97","data_contract","","sl-davidbernuau, aviv-julienjehannet","2","2","0",""
"177","fix: update cache key in CircleCI config","sl-fredericdalessandro","2025-06-27 14:26:33","2025-06-27 14:37:30","2025-06-27 14:37:32","closed","True","2","8","1","0.18","","aviv-bertrandmoundounga, aviv-hamzaeljaoui","","0","0","0",""
"176","fix: update cache key in CircleCI config","sl-fredericdalessandro","2025-06-27 13:43:03","2025-06-27 14:13:46","2025-06-27 14:13:46","closed","True","2","5","3","0.51","","aviv-hamzaeljaoui","aviv-bertrandmoundounga","1","1","0",""
"175","feat: add ISO 3166-1 alpha-2 format support in common codesets","aviv-julienjehannet","2025-06-27 12:32:32","2025-06-30 13:44:34","2025-06-30 13:44:36","closed","True","13","188","36","73.2","enhancement","aviv-fathallahelmasri, giselle-garnett","copilot-pull-request-reviewer[bot]","3","0","0","copilot-pull-request-reviewer[bot]: ## Pull Request Overview This PR adds example assertions for ISO 3166-1 alpha-2 territory codes in the `Country` class to cover French overseas territories. - Introduces commented-out assertions for validating `short_name` mapping of specific alpha-2 codes. - Targets coverage for French territories like Saint Barthélemy, French Guiana, Martinique, etc. <details> <summary>Comments suppressed due to low confidence (2)</summary> **src/aviv/commons/codesets/territory.py:1** * Commented-out assertions are not executed; to ensure the new ISO alpha-2 territory mappings are validated, move these examples into a proper test module so they run as automated tests. ``` # assert Country(""BL"").short_name == ""Saint Barthélemy"" ``` **src/aviv/commons/codesets/territory.py:1** * [nitpick] Rather than leaving usage examples as commented-out assertions, consider consolidating them into docstrings or external documentation (e.g., README) for clarity and maintainability. ``` # assert Country(""BL"").short_name == ""Saint Barthélemy"" ``` </details> | copilot-pull-request-reviewer[bot]: ## Pull Request Overview This PR adds support for ISO alpha-2 country and language codes in the common codesets and introduces a UUID v5 type in the data modeling module. - Expose a new `UUID5` type alongside `UUID4` - Alias `CountryAlpha2` and `LanguageAlpha2` as `Country`/`Language` in commons codesets - Add newsfragments documenting these new capabilities ### Reviewed Changes Copilot reviewed 7 out of 7 changed files in this pull request and generated no comments. <details> <summary>Show a summary per file</summary> | File | Description | | -------------------------------------------------- | -------------------------------------------------- | | src/aviv/data/modeling/newsfragments/+uuid-atoms.added | Document availability of the new UUID v5 type | | src/aviv/data/modeling/atoms.py | Export `UUID5` in the star-import | | src/aviv/data/modeling/__init__.py | Re-export `UUID5` in the public API | | src/aviv/commons/newsfragments/+territory.added | Document ISO 3166-1 alpha-2 country code support | | src/aviv/commons/newsfragments/+i18n.added | Document ISO 639-1 alpha-2 language code support | | src/aviv/commons/codesets/territory.py | Alias `CountryAlpha2` as `Country` | | src/aviv/commons/codesets/i18n.py | Alias `LanguageAlpha2` as `Language` | </details> <details> <summary>Comments suppressed due to low confidence (5)</summary> **src/aviv/commons/newsfragments/+territory.added:4** * [nitpick] This line refers to `Country` as a module; to avoid confusion, clarify that `Country` is an alias in the `aviv.commons.codesets.territory` module. ``` Available from the `aviv.commons.codesets.territory.Country` module. ``` **src/aviv/commons/newsfragments/+i18n.added:4** * [nitpick] Similar to above, specify that `Language` is an alias within the `aviv.commons.codesets.i18n` module rather than a standalone module. ``` Available from the `aviv.commons.codesets.i18n.Language` module. ``` **src/aviv/data/modeling/atoms.py:27** * The symbol `UUID5` is added to imports but there is no corresponding class or implementation in this module; please provide the `UUID5` type definition or import. ``` UUID5, ``` **src/aviv/data/modeling/__init__.py:20** * Re-exporting `UUID5` here assumes it is imported or defined; ensure `UUID5` is imported at the top of this file or available via the submodule. ``` ""UUID5"", ``` **src/aviv/commons/codesets/territory.py:3** * [nitpick] Commented-out asserts clutter production code; consider moving these checks into dedicated unit tests or removing them. ``` # assert Country(""BL"").short_name == ""Saint Barthélemy"" ``` </details> | copilot-pull-request-reviewer[bot]: ## Pull Request Overview Adds ISO 3166-1 alpha-2 and ISO 639-1 alpha-2 support as new common codesets, extends the modeling library with two new Pydantic types (Json and UUID5), and updates Towncrier to v24. - Introduce a new ""Codeset"" fragment type in `towncrier.toml` - Add `UUID5` and `Json` to the Pydantic atoms API - Add `territory` and `i18n` codeset modules with alias types - Bump `towncrier` dependency to `^24` ### Reviewed Changes Copilot reviewed 11 out of 12 changed files in this pull request and generated 2 comments. <details> <summary>Show a summary per file</summary> | File | Description | |--------------------------------------|-----------------------------------------------------------------| | towncrier.toml | Added a new fragment type for codesets | | src/aviv/data/modeling/atoms.py | Imported and exported `UUID5` and `Json` types | | src/aviv/data/modeling/__init__.py | Exposed `UUID5` and `Json` in the public API | | src/aviv/data/modeling/newsfragments/+optional.syntax | Introduced Optional syntax support fragment | | src/aviv/data/modeling/newsfragments/+uuid-atoms.added | Added UUID v5 data type fragment | | src/aviv/data/modeling/newsfragments/+jsontype.added | Added Json type fragment | | src/aviv/commons/newsfragments/+territory.added | Added ISO 3166-1 alpha-2 territory codeset fragment | | src/aviv/commons/newsfragments/+i18n.added | Added ISO 639-1 alpha-2 language codeset fragment | | src/aviv/commons/codesets/territory.py | Introduced `Country` alias for `CountryAlpha2` | | src/aviv/commons/codesets/i18n.py | Introduced `Language` alias for `LanguageAlpha2` | | pyproject.toml | Bumped `towncrier` dependency to `^24` | </details> <details> <summary>Comments suppressed due to low confidence (2)</summary> **src/aviv/data/modeling/atoms.py:20** * The new `Json` and `UUID5` types have been added to the public API. Consider adding or updating unit tests to cover their schema generation and validation behavior. ``` Json, ``` **src/aviv/data/modeling/newsfragments/+jsontype.added:1** * [nitpick] Use the exact Pydantic type name `Json` (capital 'J' only) in the description to avoid confusion with 'JSON' as an acronym. ``` Add JSON string data type available in the star-import. ``` </details>"
"174","Tslm 299 collect necessary data from adjust mmp in aws for ltv monitoring","aviv-nsamardzic","2025-06-27 12:16:25","","2025-06-30 12:40:33","closed","False","4","216","0","","","","aviv-imijatovic","1","1","0",""
